{
  "schema_version": "1.0",
  "snapshot_id": "app-prod",
  "name": "app-prod environment (synthetic): CI deploys with the app runtime role",
  "synthetic": true,
  "model_version": "attackgraph-rules-v1",
  "coverage": {
    "policy_controls": {
      "permissions_boundaries": "resolved",
      "service_control_policies": "resolved",
      "resource_policies": "resolved",
      "conditions": "resolved",
      "explicit_denies": "resolved"
    },
    "unmodelled_mechanisms": []
  },
  "nodes": [
    {"id": "p-ci-deployer", "kind": "principal", "label": "CI deploy user (build pipeline)", "account_id": "syn-app-prod"},
    {"id": "r-app-runtime", "kind": "role", "label": "App runtime execution role", "account_id": "syn-app-prod"},
    {"id": "r-deploy-admin", "kind": "role", "label": "Deployment admin role", "account_id": "syn-app-prod"},
    {"id": "l-build-hook", "kind": "lambda", "label": "Post-build hook function", "account_id": "syn-app-prod"},
    {"id": "o-build-artifacts", "kind": "s3_object", "label": "artifacts/release.zip", "account_id": "syn-app-prod"},
    {"id": "o-customer-export", "kind": "s3_object", "label": "exports/customers.csv", "account_id": "syn-app-prod"}
  ],
  "facts": [
    {"id": "f-ci-pass-app-runtime", "predicate": "iam_pass_role_to_lambda", "subject": "p-ci-deployer", "object": "r-app-runtime", "state": "true"},
    {"id": "f-ci-pass-deploy-admin", "predicate": "iam_pass_role_to_lambda", "subject": "p-ci-deployer", "object": "r-deploy-admin", "state": "true"},
    {"id": "f-ci-create-build-hook", "predicate": "lambda_create_function", "subject": "p-ci-deployer", "object": "l-build-hook", "state": "true"},
    {"id": "f-ci-invoke-build-hook", "predicate": "lambda_invoke_function", "subject": "p-ci-deployer", "object": "l-build-hook", "state": "true"},
    {"id": "f-ci-controls-build-hook-code", "predicate": "controls_workload_code", "subject": "p-ci-deployer", "object": "l-build-hook", "state": "true"},
    {"id": "f-app-runtime-trusts-lambda", "predicate": "role_trusts_lambda_service", "subject": "r-app-runtime", "state": "true"},
    {"id": "f-deploy-admin-trusts-lambda", "predicate": "role_trusts_lambda_service", "subject": "r-deploy-admin", "state": "true"},
    {"id": "f-ci-read-build-artifacts", "predicate": "s3_get_object", "subject": "p-ci-deployer", "object": "o-build-artifacts", "state": "true"},
    {"id": "f-ci-read-customer-export", "predicate": "s3_get_object", "subject": "p-ci-deployer", "object": "o-customer-export", "state": "false"},
    {"id": "f-app-runtime-read-build-artifacts", "predicate": "s3_get_object", "subject": "r-app-runtime", "object": "o-build-artifacts", "state": "true"},
    {"id": "f-app-runtime-read-customer-export", "predicate": "s3_get_object", "subject": "r-app-runtime", "object": "o-customer-export", "state": "false"},
    {"id": "f-app-runtime-pass-deploy-admin", "predicate": "iam_pass_role_to_lambda", "subject": "r-app-runtime", "object": "r-deploy-admin", "state": "false"},
    {"id": "f-deploy-admin-read-build-artifacts", "predicate": "s3_get_object", "subject": "r-deploy-admin", "object": "o-build-artifacts", "state": "false"},
    {"id": "f-deploy-admin-read-customer-export", "predicate": "s3_get_object", "subject": "r-deploy-admin", "object": "o-customer-export", "state": "false"},
    {"id": "f-deploy-admin-pass-app-runtime", "predicate": "iam_pass_role_to_lambda", "subject": "r-deploy-admin", "object": "r-app-runtime", "state": "false"}
  ],
  "entry_principals": ["p-ci-deployer"],
  "protected_targets": [
    {"node": "r-deploy-admin", "classification": "privileged_role"},
    {"node": "o-customer-export", "classification": "sensitive_object"}
  ],
  "expected_access": [
    {"id": "ea-ci-reads-build-artifacts", "principal": "p-ci-deployer", "target": "o-build-artifacts", "relationship": "object_read"},
    {"id": "ea-ci-deploys-app-runtime", "principal": "p-ci-deployer", "target": "r-app-runtime", "relationship": "role_use"}
  ]
}
